{
  "session_id": "session-effectiveness-2026-10-16",
  "framework_version": "0.1.1",
  "runtime": "codex",
  "created_at": "2026-10-16T22:31:10.736602+00:00",
  "summary": "Reviewed ATLAS effectiveness, inspected repository Obsidian memory and corrected continuity loss.",
  "completed_work": [
    "Inspected ATLAS baseline and recent CloudPath audit evidence.",
    "Added continuity validation and preservation of session risks, pending work and next action.",
    "Recorded project delivery lessons and preserved historical July continuity."
  ],
  "changed_files": [
    "scripts/build_resume_packet.py",
    "scripts/validate_continuity_state.py",
    "scripts/validate_all.py",
    "tests/conformance/test_continuity_state.py",
    "docs/",
    "reports/",
    ".claude/memory/",
    "obsidian/",
    ".atlas/continuity/",
    "AGENTS.md",
    "adapters/shared/session-continuity-protocol.md"
  ],
  "validation": [
    "Original full validation passed despite stale continuity.",
    "New gate reproduced stale versions, false handoffs and lost context.",
    "Four focused continuity regression tests passed.",
    "Full validate_all profile passed all 40 gates, including 342 full-suite tests and 14 policies.",
    "Documentation, Codex synchronization, runtime drift and git diff whitespace checks passed after entry-point updates."
  ],
  "decisions": [
    "Keep historical evidence unchanged; rebuild only active continuity.",
    "Evaluate product effectiveness separately from framework conformance."
  ],
  "pending_work": [
    "Measure acceptance, rework and checkpoint persistence on subsequent project tasks."
  ],
  "risks": [
    "Production flows and Windows executable were not tested in this framework review.",
    "Framework improvements require adoption in individual project repositories."
  ],
  "next_action": "Apply delivery feedback to the next project task and record observed acceptance and remaining work."
}
