{
  "session_id": "session-october-assurance-2026-10-19",
  "framework_version": "0.1.1",
  "runtime": "codex",
  "created_at": "2026-10-19T12:26:21+00:00",
  "summary": "Implemented P0 admission gates after reconciling October audit with PRs 31–34; measurement/product phases remain planned.",
  "completed_work": [
    "Recorded phased plan preserving project memory, Obsidian isolation and bounded context.",
    "Added source-integrity, permission, sandbox and scan receipt admission.",
    "Added dated model lifecycle/capability/profile/privacy/financial admission.",
    "New execution results default to partial; completed requires functional criteria and remote checkpoint.",
    "Corrected artifact-only golden-path completion claims."
  ],
  "changed_files": ["scripts/execution_assurance.py", "scripts/record_execution_result.py", "scripts/build_golden_path.py", "schemas/execution-assurance.schema.json", "schemas/execution-result.schema.json", "tests/contract/test_execution_assurance.py", "docs/execution-assurance-guide.md", "docs/october-2026-improvement-plan.md", "AGENTS.md", ".atlas/continuity/"],
  "validation": [
    "47 focused assurance and golden-path tests passed after independent review corrections.",
    "First full run detected artifact-generator compatibility failure; corrected before final validation.",
    "Final release profile passed, including 409 tests and cumulative/recovery/incremental package validation.",
    "Independent rereview approved all three resolved completion blockers; remote publication/CI must be checked at the current branch head."
  ],
  "decisions": [
    "ATLAS governs runtimes rather than implementing a sandbox or mandatory inference gateway.",
    "Preserve historical evidence; new recorder applies stricter completion admission.",
    "No real product memory migration or production effectiveness claim from framework tests."
  ],
  "pending_work": [
    "Reconcile publication, remote CI and merge status against the current remote commit before resuming; do not replay completed publishing work.",
    "Continue context-efficiency stage 2: optional sections and project-local hash cache with invalidation tests.",
    "Implement GenAI session telemetry, feature-detected AI/multimodal search measurement and router/Ollama evaluation.",
    "Adopt isolation and admission in real product tasks with functional/browser evidence; never store product memories upstream."
  ],
  "risks": [
    "Gates validate receipt integrity and declarations, not scanner/sandbox execution or semantic correctness without independent evidence review.",
    "Model inventory is operator-maintained; starter gateways need project-specific guard integration.",
    "No provider token savings, native Obsidian UI, real product migration or production behavior was measured."
  ],
  "next_action": "Confirm current remote publication/CI state, then continue context-efficiency stage 2 using the documented phase 2 acceptance criteria."
}
